rating,text,word_count,food,service,place,cost
1 sao,"một trải nghiệm đáng thất vọng góp ý chân thành từ khách hàng cũ từng rất yêu thích quán. mình là một khách hàng thân thiết, đã từng rất thường xuyên ghé pi thái vì hương vị món ăn đặc trưng, đặc biệt là món hủ tiếu thái ngon và phần nước trà đá thơm mát một điểm cộng lớn khiến bữa ăn thêm trọn vẹn. tuy nhiên, lần ghé gần đây thực sự là một trải nghiệm khiến mình thất vọng nặng nề. quán cắt giảm hoàn toàn phần trà đá, món mà trước đây từng là một dấu ấn rất riêng. mình hỏi nước suối trong menu vẫn còn thì được báo hết luôn. có cảm giác quán đang chủ đích không phục vụ nước cơ bản để ép khách mua thêm những loại nước uống khác. điều này khiến trải nghiệm bữa ăn mất đi sự thoải mái, cảm giác bị thiếu thiếu rất rõ ràng. với một người đã từng rất thích và thường xuyên ủng hộ quán như mình, đây có thể sẽ là lần ghé cuối cùng, ít nhất là cho đến khi mọi thứ được cải thiện. mình viết những dòng này không phải để công kích hay chê bai ác ý, mà chỉ mong đội ngũ pi thái có thể lắng nghe và cân nhắc điều chỉnh để lấy lại hình ảnh và sự tử tế vốn có. không phải lúc nào khách hàng cũng góp ý khi rời đi nên mong pi thái đừng xem nhẹ. xin chân thành cảm ơn đội ngũ pi thái đã đọc.",272,2,1,0,0
5 sao,"quán làm nhanh, nhân viên giới thiệu chi tiết cho người mới ăn",13,0,2,0,0
5 sao,"vị ăn rất ngon, mình đi ăn 2 lần, lần nào cũng kêu pi thái lớn, trong hình quảng cáo thì có phèo nhưng tô được bưng ra thì không hề có. chỗ ngồi đi buổi trưa như cái lò hầm, cực kỳ nóng hy vọng quán có thể làm cái gì đó để khách tới dùng 1 cách thoải mái nhất.",62,1,0,1,0
5 sao,"đồ ăn ngon, quán sạch sẽ thoáng mát",8,2,0,2,0
5 sao,quán thoáng mát. nhân viên dễ thương . đồ ăn quá tuyêth vời nhé mọi người. mọi người mua kiện bon ghé shoppe: mainemnhung nhá,23,2,2,2,0
5 sao,"đồ ăn ngon, hầu như tuần nào cũng ăn",9,2,0,0,0
5 sao,mình chưa từng ăn hủ tíu kiểu này bao giờ nhưng cảm thấy ngon từ thịt đến nước dùng quán nên mở thêm về đêm vì đêm khách tới ăn khá đông,32,2,0,0,0
5 sao,"ngon, đặc biệt là phần pi thái đặc biệt kèm nước huyết nhé mọi người",14,2,0,0,0
1 sao,"thái độ nhân viên quá tệ , mình vào trước gọi món mà bàn tới sau được đem lên trước, hỏi nhân viên thì nhân viên thái độ con phán 1 câu từ từ ,món hết cũng không nói hỏi mấy lần mới nói hết, để đồ ăn thì như dằn mặt khách ! bạn nam đeo kính không biết tên , quán mà không dạy được nhân viên kiểu này thì làm sao phát triển tốt ?",79,0,1,0,0
5 sao,quán không gian rộng rãi. nhân viên nhiệt tình vui vẻ.,11,0,2,2,0
5 sao,"không gian sạch sẽ, nhân viên nhẹ nhàng dễ thương, đến bác bảo vệ cũng dễ chịu với mình nữa. món lên nhanh nên không phải chờ lâu.",28,0,2,2,0
5 sao,"món ăn ngon, nhân viên nhiệt tình",7,2,2,0,0
5 sao,quán ăn rất ngon phục vụ thân thiện,8,2,2,0,0
5 sao,"hủ tíu thập cẩm rất ngon, sợi hủ tíu trụng dai và khẩu phần vừa phải, nước sốt ăn kèm chấm thịt đậm đà",24,2,0,0,0
5 sao,"món tomyum ngon, đậm đà. không gian quán mát mẻ, sạch sẽ",12,2,0,2,0
5 sao,"ngon, nhân viên nhiệt tình, nên thử",7,2,2,0,0
5 sao,"đồ ăn rất ngon, không gian rộng rãi mát mẻ địa điểm mặt tiền đường nên rất nhộn nhịp",19,2,0,2,0
5 sao,"đồ ăn rất ngon, rất đáng trải nghiệm.",8,2,0,0,0
5 sao,"nhân viên dễ thương nhé, đồ ăn ngon với lại hợp khẩu vị mình",14,2,2,0,0
5 sao,"đồ ăn ngon, chất lượng món chuẩn, phục vụ siêu nhanh",11,2,2,0,0
5 sao,đồ ăn rất ngon sẽ ủng hộ nhiều lần,9,2,0,0,0
5 sao,"có phòng riêng, tầm dưới chục ngườiphòng ổn. đồ ăn ngon. mải ăn quên chụp.",15,2,0,2,0
5 sao,"đồ ăn ngon, nhân viên phục vụ chu đáo, giá cả hợp lý. mình và gia đình đã ghé lại nhiều lần và luôn hài lòng. mong quán tiếp tục hoạt động lâu dài để có thể thưởng thức những bữa cơm ngon thêm nhiều lần nữa. hihi",48,2,2,0,2
5 sao,"đồ ăn ngon, quán có phòng riêng tiếp khách, không gian đẹp",12,2,0,2,0
5 sao,"không gian thoáng và mát, đồ ăn ngon, giá cả ổn, thái độ nhân viên vui vẻ và nhiệt tình",20,2,2,2,2
5 sao,"đồ ăn siêu ngon, nvien siêu thân thiện",8,2,2,0,0
5 sao,"mình ghé quán vào buổi tối, quán khá đông khách nhưng nhân viên nhiệt tình, nhanh nhẹn, luôn sẵn sàng hỗ trợ khách hàng và siêu dễ thương. menu quán rất đa dạng. món ăn mang đậm hương vị quê, đặc biệt là phần cơm niêu cháy cạnh ăn cùng ba chỉ cháy cạnh và cá rô chiên mắm gừng đậm đà, tròn vị, ăn rất bắt cơm. giá cả quá hợp lý chỉ từ 0 món không gian sạch sẽ, thoáng mát, ấm cúng. rất thích hợp cho bữa cơm gia đình, nhóm bạn và khách du lịch. đáng để quay lại nhiều lần, nhất là trong những ngày thời tiết se lạnh của đà lạt.",118,2,2,2,2
5 sao,siêu ngon 10 điểm,4,2,0,0,0
1 sao,"từ nhân viên bảo vệ, phục vụ đến quản lý nói chuyện rất không lịch sự, như muốn chửi mặt khách. khách đưa tiền không có tiền thối, rồi làm thái độ. quán đông full bàn món lên chậm còn thông cảm được, vô quán vắng hơn chùa mà món nào cũng 30p- 1h. nhân viên vừa làm vừa ngủ à",61,0,1,0,0
4 sao,ngon lắm mọi người ơi. tuyệt vời ông mặt trời.,10,2,0,0,0
5 sao,lần đầu tiên tới nhé̀ hàngười vị quê hương vị mẹ nấu lúc mình còn ở quê nhé̀ mình mẹ nấu. nay được ăn minh nhớ đến mẹ. nhưng nay có vị quê mình được ăn hương vị này rất tuyệt vời. cảm ơn vì quê.,46,2,0,0,0
5 sao,thái độ phục vụ kém.,5,0,1,0,0
5 sao,"đồ ăn quán rất ngonn, không ăn thử là phí lắm, không khí trong lành, phục vụ nhiệt tình lắm luôn áaa, mờ ê mê luôn",26,2,2,2,0
1 sao,bảo vệ hơi mất dạy bố láo,7,0,1,0,0
1 sao,thực sự rất thất vọng! đồ ăn rất chán! gọi đồ 40p mang ra mà lại rất mắc! mình ăn được nửa chén phải gói mang về vì rất bực về thái đồ phục vụ! cảnh báo mọi người ai đi ăn thì né ra!,44,1,1,0,1
5 sao,"không gian thoáng mát, đồ ăn ngon, phục vụ nhiệt tình dễ thương",13,2,2,2,0
5 sao,"món ăn tươi ngon, phục vụ tận tình chu đáo, không gian quán khá đẹp. mình rất ấn tượng khi bước vào quán.",23,2,2,2,0
3 sao,"phụ vụ không tốt. đồ ăn không đúng vị. cá bống kho còn nước lủm bủm. nước màu không vàng con cá, vì nước còn nhiều nên ăn bị tanh",30,1,1,0,0
5 sao,"đồ ăn ngon, đậm đà, đã đến 2 lần, phục vụ ổn.",12,2,3,0,0
5 sao,"quán ngon, không gian ấm cúng. tiếp khách ổn.",9,2,0,2,0
1 sao,"ăn trưa kêu đồ ăn ra chậm ăn gần xong mới mang ra , đồ ăn dở quá mắc . không bao giơ quay lại lần 2",27,1,1,0,1
4 sao,đồ ăn tạm ổn. phục vụ không nhiệt tình lắm,10,3,1,0,0
4 sao,"đồ ăn ngon, giá hợp lý, nhân viên nhiệt tình, vui vẻ, thân thiện, toilet sạch",16,2,2,2,2
5 sao,"không gian không được rộng rãi lắm. tuy nhiên món ăn khá ổn, phục vụ được.",16,3,3,1,0
5 sao,"món ăn ngon, phục vụ chu đáo, nhân viên thân thiện, giá cả hợp lý.",15,2,2,0,2
1 sao,đồ ăn lên quá chậm. không ngon,7,1,1,0,0
5 sao,tuyệt vời,2,0,0,0,0
5 sao,đồ nhậu ngon. phục vụ nhanh. có loa kẹo kéo cho hát trong phòng luôn,15,2,2,2,0
5 sao,"ngon, phục vụ nhiệt tình. máy lạnh không mát lắm",10,2,2,1,0
5 sao,"gặp bạn là chính, password: bạn anh tuấn anh trưởng phòng kd bảo hiểm tàu pjico.",16,0,0,0,0
5 sao,"hương vị độc đáo, ngon ! hơi khó tìm vì biển hiệu nhỏ, khuất.",14,2,0,1,0
5 sao,thức ăn ngon. nhân viên trẻ nhiệt tình,8,2,2,0,0
4 sao,"quán mát, đồ ngon, nhân viên nhanh nhẹn",8,2,2,2,0
5 sao,cà phê ngon,3,2,0,0,0
5 sao,"món ăn vị miền bắc ngon, đặc sản",8,2,0,0,0
5 sao,"quạ ăn ấm cúng, chất lượng tốt",7,0,0,2,0
5 sao,mang đến những gì tốt nhất cho khách hàng,9,0,2,0,0
1 sao,mấy em múp lắm,4,0,0,0,0
4 sao,rất tốt cho mọi gia đình cùng ăn cơm chung,10,0,0,0,0
4 sao,cảm giác khá giống nhậu ngoài hà nội,8,0,0,0,0
5 sao,rất ngon,2,2,0,0,0
4 sao,nhé dân sự,3,0,0,0,0
3 sao,khu vực này thì cũng cho là được,8,0,0,3,0
5 sao,ăn ngon lịch sự nhé,5,2,2,0,0
4 sao,tạm được,2,3,0,0,0
4 sao,ngon bổ rẻ,3,2,0,0,2
5 sao,bia hà nội,3,0,0,0,0
4 sao,phục vụ hơi kém,4,0,1,0,0
5 sao,đủ món,2,3,0,0,0
2 sao,phục vụ tệ,3,0,1,0,0
4 sao,tương đối được,3,3,0,0,0
5 sao,quán ngon.,2,2,0,0,0
5 sao,ngon,1,2,0,0,0
4 sao,đồng ý,2,0,0,0,0
2 sao,"nhân viên không am hiểu menu, không biết quán có món gì và hết món gì. mình gọi phần combo có phô mai que và gọi thêm khoai tây. nhân viên hỏi mình order khoai lớn hay nhỏ, mình chọn lớn thì nhân viên bấm khoai tây lắc, lúc tính tiền mình hỏi lại thì nhân viên nói chỉ có khoai lắc phô mai là cỡ lớn. sau khi trả tiền, nhân viên mới nói hết phô mai que rồi và quán chỉ có thể cho mình khoai lắc. mấy món khác cũng không ngon, gà sốt ngon nhưng quá khô, mì ý nguội, burger rất chán, không có một miếng sốt nào. không gian ngồi nóng, bàn không sạch. giá tiền không xứng đáng với dịch vụ và đồ ăn, sẽ không quay lại.",132,1,1,1,1
4 sao,"thì ở đâu cueng zị về đồ ăn phục vụ còn vị trí ở đây trên lầu sạch sẽ, thoáng mát và nhiều bàn ghế cho tiệc đông trẻ em",31,3,3,2,0
1 sao,"ăn sốt phô mai mà t tưởng uống chai giấm ăn chua lè , không phải đánh giá ảo",21,1,0,0,0
1 sao,"ủa đúng thì mỳ dak có cheese line trong sốt mà cái này cửa hàng không bỏ cheese line vào sốt à? mỳ thì bị lạt với bị rụt á, trải nghiệm tệ thiệt sự. đừng nghĩ khách không biết mà muốn làm sao cũng được",45,1,0,0,0
1 sao,"nhân viên có thái độ thiếu chuyên nghiệp, giao tiếp chưa lịch sự. khu vực bếp nhìn chưa sạch sẽ, toilet có mùi và khá bẩn. mình từng là khách và cũng từng làm việc ở đây nên những nhận xét này là từ trải nghiệm thực tế. quán nên xem lại cách quản lý và vệ sinh để cải thiện hình ảnh.",63,0,1,1,0
4 sao,"quán ngay góc đường ngã tư đông đúc khu sinh viên, phục vụ nhanh nhẹn, đồ ăn giống những chi nhánh khác.",22,3,2,0,0
5 sao,"nhân viên cẩm lý dễ thương, không gian thoáng mát sạch sẽ, đồ ăn ở đây thì khỏi phải bàn rồi, 10 đỉm",23,2,2,2,0
5 sao,"đáng khen nhất là quán lotteria này có gà rán chiên giòn, mỏng bột, bột phủ đều không bị quá dày và thịt không bị khô. gà chiên vị vừa không bị mặn. các bạn nhân viên ở đây cũng dễ chịu, lễ phép chịu khó giới thiệu nhiều conbo. mình đến buổi trưa nên quán đông và hơi ồn, tuy nhiên bếp ra món vẫn rất nhanh. -1điểm cho bảo vệ không nhiệt tình nhưng không ảnh hưởng lắm đến trải nghiệm của mình. quán đáng để được trải nghiệm và ủng hộ.",93,2,2,1,0
5 sao,"vị trí ngay góc đường. không gian rộng có view. thích nữa thì ra bancony ngắm cảnh được luôn. phần này là 85 vnd, thêm sốt như hình thì thêm 8 vnd. lâu lâu ăn đổi gió vui miệng",37,3,0,2,0
1 sao,"thái độ nhân viên tốt đồ ăn cũng ổn nhưng bảo vệ thì ý thức và hành động quá tệ, dắt xe không dắt chỉ biết nằm một chỗ trên yên xe nghe nhạc thật sự quá tệ khách bị gì xe đè hay ngã cũng nằm nghe nhạc",49,3,1,0,0
4 sao,"theo mình thì cách bài trí của quán rất phù hợp với ăn cùng gia đình,bạn bè hay người thân bầu không khí thì cũng yên tĩnh phù hợp các bạn sinh viên ngồi bàn việc nhóm hay ngồi lại làm việc đồ ăn thì theo mình là ở mức ổn . mình có chút góp ý là quán nên xịt mũi định kỳ chứ hôm mình đến quán có vài con mũi như vậy khiến cho trải nghiệm của của khách hàng trở nên tệ hơn",87,3,0,1,0
5 sao,đồ ăn ngon nhân viên dễ thương,7,2,2,0,0
1 sao,"mình mua burger tôm mà về mở ra thấy như này ạ, lần đầu mình ăn thử nhưng thấy nó sai sai ạ. quán vui lòng xem giúp mình có phải tôm không ạ, mua với giá 49 vnd",38,1,0,0,0
5 sao,"quán thoáng mát, yên tĩnh, nhà vệ sinh sạch sẽ là điểm cộng rất tốt. nhân viên tư vấn nhiều combo khuyến mãi khác nhau, nói chung cũng rẻ cho mình lựa chọn món. đồ ăn thì có phần ngon hơn các chi nhánh khác theo mình cảm nhận. các bạn nên ghé thử ở đây đặc biệt buổi trưa rất rẻ. nhưng mà có vẻ bảo vệ không được tốt lắm kiểu không thân thiện. nhưng mà không sao do mình đi bộ",84,2,2,2,2
1 sao,nhân viên hỏi không trả lời nói chuyên với nhau khi làm việc. không vui vẻ khó chịu quản lý của hàng này nên coi lại,26,0,1,0,0
5 sao,"quán có không gian ấm cúng, decor đẹp và sạch sẽ. nước uống ngon, giá cả hợp lý đi đôi với chất lượng. phục vụ nhanh chóng và nhân viên niềm nở với khách hàng. chắc chắn sẽ quay lạicuối tuần nào gia đình mình cũng ghé vincom tây ninh. nơi đây có đủ mọi thứ từ khu vui chơi trẻ em, siêu thị đến rạp phim. mọi người đều rất vui vẻ và thoải mái. cảm ơn vincom đã mang đến một địa điểm giải trí chất lượng!chào mừng bạn đến với bảng nhớ tạm của gboard, bất kỳ văn bản nào bạn sao chép sẽ được lưu tại đây.nhấn vào một đoạn để dán vào hộp văn bản.chạm và giữ một đoạn để ghim đoạn đó. các đoạn đã bỏ ghim sẽ bị xóa sau 1 giờ.chạm và giữ một đoạn để ghim đoạn đó. các đoạn đã bỏ ghim sẽ bị xóa sau 1 giờ.chạm và giữ một đoạn để ghim đoạn đó. các đoạn đã bỏ ghim sẽ bị xóa sau 1 giờ.chạm và giữ một đoạn để ghim đoạn đó. các đoạn đã bỏ ghim sẽ bị xóa sau 1 giờ.chạm và giữ một đoạn để ghim đoạn đó. các đoạn đã bỏ ghim sẽ bị xóa sau 1 giờ.chạm và giữ một đoạn để ghim đoạn đó. các đoạn đã bỏ ghim sẽ bị xóa sau 1 giờ.chạm và giữ một đoạn để ghim đoạn đó. các đoạn đã bỏ ghim sẽ bị xóa sau 1 giờ.chạm và giữ một đoạn để ghim đoạn đó. các đoạn đã bỏ ghim sẽ bị xóa sau 1 giờ.chạm và giữ một đoạn để ghim đoạn đó. các đoạn đã bỏ ghim sẽ bị xóa sau 1 giờ.chạm và giữ một đoạn để ghim đoạn đó. các đoạn đã bỏ ghim sẽ bị xóa sau 1 giờ.sử dụng biểu tượng chỉnh sửa để ghim, thêm hoặc xóa đoạn.sử dụng biểu tượng chỉnh sửa để ghim, thêm hoặc xóa đoạn.sử dụng biểu tượng chỉnh sửa để ghim, thêm hoặc xóa đoạn.sử dụng biểu tượng chỉnh sửa để ghim, thêm hoặc xóa đoạn.sử dụng biểu tượng chỉnh sửa để ghim, thêm hoặc xóa đoạn.sử dụng biểu tượng chỉnh sửa để ghim, thêm hoặc xóa đoạn.sử dụng biểu tượng chỉnh sửa để ghim, thêm hoặc xóa đoạn.sử dụng biểu tượng chỉnh sửa để ghim, thêm hoặc xóa đoạn.sử dụng biểu tượng chỉnh sửa để ghim, thêm hoặc xóa đoạn.sử dụng biểu tượng chỉnh sửa để ghim, thêm hoặc xóa đoạn.",420,2,2,2,2
4 sao,"phần ăn của mình nóng hổi, cảm thấy khá đầy đủ và ngon. phần cơm có kèm ly nước ngọt size vừa. muỗng nĩa ăn 1 lần nhưng là loại dày, khá chắc chắn. hôm mình tới 042023, nhân viên nhanh nhẹn. cô bảo về thấy mình bước vào không đi xe thì lườm mình dù mình đi ngang vẫn chào cô ấy như 1 phép lịch sự. có 1 bạn nhân viên làm lơ khách. nói chung lotteria nên train lại nhân viên, đừng để 1-2 thành phần nhỏ mà ảnh hưởng đến toàn hệ thống.",97,2,1,0,0
5 sao,thật vuýp quán này xịn nhé có phòng máy lạnh để họp nhóm,13,0,0,2,0
1 sao,"đưa phần ăn khách đi lên lầu xong lại phải chạy xuống lấy phần chưa nhận hết, trc đó đã nhờ đem lên dùm rồi, thí dụ thấy không đem lên được thì nói với khách để ngta đợi lấy cho đủ, đang ăn mà cái thẻ đợi reo in ỏi, chạy lên chạy xuống mà mệt luôn. hỏi nhân viên thì nói quên, chán thật sự",66,0,1,0,0
5 sao,"ăn tại chỗ thì phải lên lầu, quán ngay góc đường cạnh trường đh công nghiệp. đặc biệt nhà vệ sinh rất rộng rãi và sạch sẽ",27,0,0,2,0
5 sao,"nhân viên vui vẻ, nhiệt tình. cô và chú bảo vệ rất dễ thương, vui vẻ luôn nhé",18,0,2,0,0
5 sao,nhân viên tư vấn nhiều ưu đãi. đồ ăn hợp khẩu vị.,12,2,2,0,0
3 sao,mua cây kem nhân viên kêu không tiền thối bắt tự đi đổi tiền không thì đổi cách thanh toán. quá thiếu chuyên nghiệp,24,0,1,0,0
5 sao,"tương ớt cực chill. có 3 loại tương: tương cà, tương ớt và có cả tương ngọt. điểm nhấn của quán là tương ngọt cực ngon. nhân viên dễ thương, hỗ trợ khách hàng tận tình, chu đáo. gà giòn, sốt đậm vị. đĩa sạch, không gian thoáng mát, phù hợp để ăn uống và mừng tiệc. tổng quan: 100đ",60,2,2,2,0
5 sao,"quán làm món cũng khá nhanh nhưng buổi trưa nhiều khách quá đợi hơi lâu nhưng cx không sao, đợi được",21,0,3,0,0
1 sao,thái độ lòi lõm nói cái cho ăn như cơm tù,11,0,1,0,0
5 sao,"đồ ăn siêu ngon, đậm vị nhân viên phục vụ nhiệt tình, dễ thương nước ngọt ngon, không gian sạch sẽ thoáng mát. view 10đ không có nhưng.",28,2,2,2,0
5 sao,"nhân viên nhiệt tình, phục vụ tốt, giao hàng nhân, món ăn còn nóng khi đến tay dù trời mưa",20,2,2,0,0
1 sao,"order về, ghi rõ kêu 3 cái má đùi, bán cho 1 cái cánh với 2 cái ức gà, éo hiểu nổi bán kiểu gì. không phân biệt nổi cái má đùi với cái ức à?",36,1,1,0,0
5 sao,"cơm ngon rẻ, nhân viên thân thiện không khí mát mẻ nên ghé ăn thử để trải nghiệm dịch vụ bên này nhé.",23,2,2,2,2
4 sao,"gà giòn , nhân viên nhiệt tình , không gian máy lạnh khá mát, nếu nước cam tươi thì ổn hơn",21,2,2,2,0
5 sao,một thời sinh viên gắng liền với nơi đây mỗi lúc tan học thường vào đây để tránh nóng quán nằm ngay ngã ba nguyễn văn nghi và lê lợi kế bên trường đại học công nghiệp nên thường có rất đông các bạn sinh viên đây ăn uống và học tập. không gian quán thì rộng rãi lẫu hai bạn có thể học nhóm chung với bạn nè.,69,0,0,2,0
5 sao,"mới khám phá ra chổ học bài khá yên tĩnh, riêng tư và hợp lý. có cả phòng học nhóm riêng từ 4 người nửa. nhưng mà tôi đi có 2 người nên không được xài hơi bùn nhen",39,0,0,2,0
5 sao,"mình đến giờ cao điểm nên quán rất đông. các bạn nhân viên vẫn làm việc rất nhiệt tình. có 1 vài anh shipper thái độ rất khó chịu với nhân viên tuy nhiên các bạn vẫn giữ được bình tĩnh rất tốt. nếu là mình thì chưa chắc đã làm được vậy. thấy mà thương các bạn nhân viên ở đây. đánh giá này để dành tặng các bạn, mình sẽ thường xuyên ủng hộ nơi đây",78,0,2,0,0
5 sao,"riêng cá nhân mình thì thấy đồ ăn ở đây rất rẻ, rẻ hơn những chổ khác kể cả phần ăn trưa. nhân viên phục vụ rất nhanh hầu như món nào cũng vài phút và nóng hôm mình đi ăn có 1 bạn rất xinh và order cho mình cũng nhiệt tình! nhưng không gian hơi nhỏ mình thấy khá ồn vào giờ trưa",67,0,2,1,2
5 sao,"nhân viên nhiệt tình, chăm sóc khách hàng chu đáo có 10sao cho hẳn 10 sao",16,0,2,0,0
5 sao,ngon nên thử nhé,4,2,0,0,0
5 sao,"đồ ăn làm nhanh mà vẫn nóng. gà của lotte khá hợp khẩu vị mình nên không có gì để chê cả nhân viên thân thiện, nhiệt tình",28,2,2,0,0
1 sao,"nhân viên thì thái độ, còn xe mà mới mới mà đi ăn ở chi nhánh này thì xác định bảo vệ dắt cọ quẹt cho bấy nhầy hết. thà chịu khó qua nguyễn văn lượng cho rước cục tức vào người",42,0,1,0,0
5 sao,"thấy có vẻ nhiều người chê nhưng trải nghiệm của mình lại khá ổn. đồ ăn: tuỳ món, giá khá ổn, gà sốt phô mai mình thử siêu ngon ăn nghiện luôn, miếng nào cũng nhiều sốt, đáng thử. tuy nhiên bên lotteria sử dụng muỗng, nĩa nhựa khá khó ăn, mô hình tự phục vụ. 55 dịch vụ: nhân viên bình thường, ít, thái độ chưa niềm nở lắm nhưng cũng không tới mức quá đáng, đồ ăn ra nhanh và nóng. các bác bảo vệ rất dễ thương và niềm nở nhé hehe. 45 không gian: rộng rãi sáng sủa có máy lạnh nhé, chi nhánh bên này tận 2,3 tầng nên không lo thiếu chỗ, có các bàn kế bên mặt kính view ngắm đường cũng rất đẹp, nhưng sẽ hơi chói chang khi đi vào tầm trưa. mình đi 2h trưa nên vắng, yên tĩnh như quán cà phê chạy deadline một số hôm tổ chức sinh nhật thì ồn ào lắm. cách bày trí sắp xếp bàn ghế khá đẹp và thoáng, màu chủ đạo đỏ, trắng, nhân viên dọn dẹp thường xuyên nên sạch sẽ và mùi dễ chịu. để xe free trước cửa. điểm cộng: phía trong có dịch vụ 2-3 phòng riêng biệt để học nhóm đầy đủ máy lạnh, bàn ghế dài sạch sẽ đăng kí trước với bên lotteria 55 chung quy lại: nếu để lên ăn uống xong đi về thì ổn, giá như thế nên cx không yêu cầu quá cao về nhân viên mấy, hoan hỉ thôi.",261,2,3,2,2
5 sao,"gà rán ở đây ngon hơn với những lotteria ở cùng chi nhánh, gà giòn, nóng, ngon, mỏng bột, không gian rộng rãi, mát mẻ, nhân viên dễ thương, thân thiện. highly recommend mọi người đến đây ăn nhé",39,2,2,2,0
5 sao,gà ngon. nhân viên phục vụ siêu lẹ,8,2,2,0,0
5 sao,các bạn nhân viên ở chi nhánh này luôn hỗ trợ mình lấy đùi cho bé,17,0,2,0,0
4 sao,vắng khách ngồi ăn tại chỗ nên ngồi làm việc cũng ổn. nhân viên vui vẻ và.xinh cô giữ xe cũng vui vẻ và thân thiện.,26,0,2,2,0
5 sao,"nhân viên dễ thương, đồ ăn ngon xỉu up xỉu down",11,2,2,0,0
5 sao,quán khá phục vụ cũng nhanh buổi tối mình đi có sinh nhật nên hơi ồn ào không gian cũng sạch sẽ nhân viên phục vụ lịch sự,28,0,2,2,0
1 sao,đặt hàng trên app combo 99 vnd 2 miếng gà với 1 miếng gà được tặng tổng 3 miếng mà quán giao có 2 miếng là sao ?,27,0,1,0,0
5 sao,trải nghiệm tốt đồ ăn rất ngon phục vụ ổn 10 đ,12,2,2,0,0
5 sao,"đồ ăn ngon,phục vụ nhiệt tình, không gian thoải mái.",10,2,2,2,0
2 sao,"nhân viên phục vụ tệ, bảo vệ thì như mẹ thiên hạ, đi 2 người cho 1 cái nĩa 2 dao, đồ ăn thì chậm, chờ gần 30p phải xuống hỏi mới có trong khi quán vắng",37,0,1,0,0
5 sao,"chị quản lý rất dễ thương, rất duyên",7,0,2,0,0
5 sao,"nhân viên tư vấn nhiều ưu đãi, thân thiện, dễ thương, đồ ăn hợp khẩu vị, ngon, mọi người nên ghé thăm nhé",22,2,2,0,0
5 sao,"gà dở nhé ạ, mấy năm rồi ăn lại vẫn dở, gà rán mà như gà kho rất mặn nhé lotteria ơi, có thể kèm thêm dĩa cơm ăn với gà sẽ dễ ăn hơn, à thêm dĩa rau nữa vì nhiều dầu hơi ngán.",45,1,0,0,0
5 sao,đồ ăn hợp khẩu vị,5,2,0,0,0
