rating,text,word_count,food,service,place,cost
3 sao,"đồ ăn ngon, giá cũng ổn. nhân viên nữ hơi lơ lơ, ngơ ngơ, hỏi gì cũng gật nhưng lại không để tâm. bàn t gọi đĩa miến trộn từ đầu mà đợi cả tiếng không ra. những món gọi sau thì lên đều. tới lúc t cáu rồi mắng cho trận mới ra được đĩa miến làm tụi nhỏ đói mốc meo ra",64,2,1,0,2
1 sao,quán đồ ăn ổn mà nhân viên không tốt bạn tóc xù thái đôn với dằn mân sáng chén mat khách kiêu lấy nc chấm hì thái độ ra nrox lần sao tôi không đến quán này nua,38,3,1,0,0
1 sao,quán nhân viên phục vục quá tệ . mua ăn lẩu mà không đem bún ra với vá múc lẩu . phải đợi hỏi mới đem ra . xin thêm nước lẩu thì kêu nghỉ bếp không còn nước lẩu,40,0,1,0,0
1 sao,tệ nhất là món cơm chiên: có thể là do dầu ăn có vấn đề tôi và cả nhóm gồm11-12 người cảm thấy mùi hôi của cơm chiên . tôi không muốn nói nhiều vì cả nhóm đang ăn và không muốn bầu không khí của quán sáo trộn. mong quán rút kinh nghiệm,56,1,0,0,0
5 sao,quán ngon lắm mọi nguoi oi mọi nguoi đến ăn thử nhé quán bán đồ ăn rẻ hợp với giá tiền lắm luôn không chê vào đâu được,28,2,0,0,2
5 sao,"đồ ăn ngon cực , nhân viên quán nhiệt tình dễ thương lắm luôn bầu không khí thì chil chil chụp hình cực đẹp luôn bị mê quán này chưa bao h thấy quán đỉnh như v luôn",38,2,2,2,0
5 sao,"quán ổn, đồ ăn ra nhanh nhân viên nhiệt tình dễ thương, quán đông nên nhiều khi gọi nhân viên hơi lâu nhưng chung quy ổn nhé 9đ",28,0,2,0,0
5 sao,quán ngon nhé mọi nguoi lần đầu đi quán siêu ngon nhu vậy nhân viên ổn lắm nhé mê bé thành,21,2,2,0,0
5 sao,nhân viên. nhiệt tình quản lí xuất sắc phục vụ khách rất tận tình chu đáo,16,0,2,0,0
1 sao,"đồ ăn thì tạm ổn ! nhưng phục vụ quá tệ, xin chén nước chấm mà ngồi từ lúc món ra đến lúc ăn hết món vẫn chưa thấy, xin cái muỗng ăn cơm cũng không có ! lên món thì chậm, kêu có 3 món mà 2 tiếng vẫn không lên đủ được. ăn mất cả hứng",58,3,1,0,0
5 sao,"không khí vui vẻ, bia hơi ngon. sẽ còn quay lại!",11,0,0,2,0
5 sao,đồ an ngon lắm luôn nhân viên vui tính nhiệt tình nữa mê quán này sỉu,16,2,2,0,0
5 sao,mình đi gia đình ngồi bên trên rất ổn nhé giá cũng phải chăng ai ở gò vấp thì nên ghé trãi nghiệm nè,24,0,0,2,2
5 sao,quán khá chill. trên lầu thoáng mát ai muốn ngồi thì nên đặt bàn trước nhé vì hay full đồ ăn ổn 910,23,3,0,2,0
5 sao,ngon với giá ổn lắm nhé mọi người,7,2,0,0,2
5 sao,"đồ ăn ngon, rẻ, phù hợp với giá tiền nhân viên phục vụ nhiệt tình",15,2,2,0,2
5 sao,bạn thành phục vụ tốt lám nhé cười dể thương lắm đồ ăn siêu ngon giá ổn mà mát mẻ nữa,21,2,2,2,2
5 sao,"mồi ngon, không gian thoáng mát",6,2,0,2,0
5 sao,"quán giá khá rẻ món ăn ngon, nhân viên dễ thương sẽ quay lại",14,2,2,0,2
5 sao,quán ngon lám ạ nhân viên dthw sỉu luôn quán siêu ngon lầm đầu đếm thấy quán rất vui nhân viên nhiệt tình,23,2,2,2,0
5 sao,quán món ăn ngon. có điều hơi lâu do quán quá đông khách. nhưng món ăn ngon thông cảm được,20,2,1,0,0
5 sao,quán đồ ăn ngon lám nhé mấy ní yêu nhân viên dthw sỉu cute lắm nhé thành dthww vãii,20,2,2,0,0
5 sao,quán rất ngon nhân viên vui tính đồ an lên nhanh quán rất vui luôn mọi nguoi đến ủng hộ nhé,21,2,2,0,0
5 sao,đồ ăn ngon nhân viên phục vụ nhiệt tình lễ phép không gian rộng rãi thoáng mát,17,2,2,2,0
1 sao,"dở, đồ không tươi, ăn cái lẩu thái như bị xúc phạm vị giác, mặn đổ hơn 600ml nước vẫn mặn nước khoáng của tôi kêu ra. đặc điểm chung của các quán đông đúc khác hoặc đồ ăn ngon, hoặc dịch vụ tốt, có lời hỏi thăm hoặc để ý khách cần gì, này không thấy gì trong mấy thứ trên, cả cái bàn bên cạnh nhân viên đứng chơi tới lúc hết khách phải xin đá.",78,1,1,0,0
5 sao,bia hơi ở đây ngon nè khá chuẩn gốc hà nội đồ ăn tạm ổn trên lầu chill chill,19,3,0,2,0
5 sao,tôi rất thích quán này phục vụ rất nhiệt tình đồ ăn ngon bầu không khí trên lầu thoáng mát,20,2,2,2,0
5 sao,quán vụ phuc ổn có bạn lgbt tên thành dể thuong nhiệt tình vui vẻ kiêu dạ vâng lần sao đến nữa ạ,23,0,2,0,0
5 sao,"quán ồn ào vui vẻ đồ ăn cũng cũng , nhân viên nhiệt tình. bạn tóc đỏ dễ thưn",19,3,2,3,0
2 sao,"quán phục vụ không ổn lắm, toilet chỉ có một cái đợi hơi lâu, nhậu mà chờ đái trong quần",22,0,1,1,0
5 sao,nhân viên nhiệt tình.đồ ăn thì vừa tầm giá .chắc chắc sẻ quay lại,14,3,2,0,2
5 sao,đồ ăn ngon. quán đông vui nhộn nhịp. ra món nhanh 9đ,12,2,2,2,0
5 sao,trời món ăn nó ngon mà cái view nó chill. nói chung ổn,13,2,0,2,0
5 sao,quá tuyệt luôn nhân viên hòa đồng không khí đông vui wiew cũng đỉnh nhốt đồ ăn giá không cao mà đồ ăn đúng vị nhé nói chung là mê nên là cho 5sao có lần sau sẽ ghé,39,2,2,2,2
5 sao,"quán nhậu view thoáng rất mát, giá đồ ăn vừa phải. món ngon. ai ở gò vấp chắc cũng biết quán này . đi nhậu ổn phết",27,2,0,2,2
5 sao,"quán đồ ăn ngon giá mềm, có mấy món lạ nhưng khá ngon. nhân viên phục vụ nhiệt tình. sẽ quay lại vào lần sau",25,2,2,0,2
5 sao,món ăn ngon. phục vụ nhiệt tình ai thích bia hơi với nhâm nhi thì ghé thử nhé,18,2,2,0,0
4 sao,"bia ngon, phục vụ dễ thương, đồ ăn ngon",9,2,2,0,0
5 sao,nhân viên ổn nhiệt tình nhann nhẹn dễ thương,9,0,2,0,0
5 sao,giá mềm thuc an ngon. mọi người ghé an thu nhé,10,2,0,0,2
5 sao,đồ ăn ngon trãi nghiệm tốt ra đồ ăn nhanh vãi quán bình dân lại còn có wiu lề đường nên trãi nghiệm nhân viên tên hiếu đẹp trai dễ thương,30,2,2,2,0
5 sao,"đồ ăn phải gọi là rất ngon, nhân viên phục vụ vui vẻ nhiệt tình",15,2,2,0,0
1 sao,nhân viên phục vụ quá tệ đồ ăn dỡ ốc chưa chính nên né nhé mọi người,17,1,1,0,0
1 sao,đây là bill của quán.,5,0,0,0,0
5 sao,quán rộng rãi. mình khá ấn tượng vì quánluôn sạch sẽ đồ ăn kha rẻ so với khu phạm văn đồng. mình đi 3 người có 300 mấy,28,0,0,2,2
5 sao,quán rất ngon phục vụ nhiệt tình lầu trên quán rất mát mẻ không giận rộng,16,2,2,2,0
5 sao,đồ ăn rất ngon .phục vụ nhiệt tình,8,2,2,0,0
5 sao,"nhân viên nhiệt tình dể thương ra món nhanh giá cả hợp lý ,ngon.",15,2,2,0,2
5 sao,đồ ăn ngon giá ổn nhân viên nhiệt tình,9,2,2,0,2
5 sao,"bia hơi ngon, đồ ăn đậm đà không khí ô kê đông đúc đồ ăn ngon giá hợp lý cho 9đ còn - 1 điểm nhiều khi đông gọi nhân viên không nge đo nhạc lớn",36,2,1,1,2
5 sao,"quán có bia hơi ngon, đồ ăn ngon nhân viên rất nhiệt tình luôn ạ, thanks quán nhiều",18,2,2,0,0
5 sao,quán đồ ăn ngon nhân viên dễ thương nhiệt tình,10,2,2,0,0
3 sao,quán bán đồ ăn ngon nhưng hơi ồn,8,2,0,1,0
5 sao,"quán ngon nhậu tới nốc, phục vụ nhanh",8,2,2,0,0
5 sao,"bia hơi ngon, lẩu ngon giá rẻ bình dân. khong gian chill mát mẻ , mình đi gia đình chia ra người có 150 vnd",24,2,0,2,2
5 sao,lẩu gà ớt hiểm ngon. lần nào mình đi ngang cũng phải ghé ăn quán ngay mặt tiền nhưng giá rất bình dân đáng thử,25,2,0,0,2
5 sao,"món ăn hợp khẩu vị,nhân viên nhiệt tình, nhất là bạn xù nhiệt tình vui vẻ",16,2,2,0,0
5 sao,mình khá thích bia hơi và các món bắc ở đây có vẻ ổn giá bình dân ở khu gò vấp,21,2,0,0,2
5 sao,"đồ ăn rất ngon, nhất là lẩu gà vừa miệng, nhân viên phục vụ chu đáo. sẽ quay lại",19,2,2,0,0
5 sao,"không gian thoáng mát, nhân viên nhiệt tình đồ ăn ngon.",11,2,2,2,0
5 sao,giá cả hợp lý. phục vụ nhiệt tình,8,0,2,0,2
5 sao,lẩu gà lá é ngon tuyệt vời . không gian mát mẻ có áp dụng chương trình giảm giá phải chăn,21,2,0,2,2
5 sao,"không gian thoáng mát, đồ ăn phù hợp với giá tiền",11,0,0,2,3
2 sao,quán không gian quá chật hẹp. ngay gần đèn đỏ rất nguy hiểm.,13,0,0,1,0
5 sao,quán ăn ngon giá tiền hợp lý sẽ ủng hộ quán lâu dài,13,2,0,0,2
5 sao,"view xịn , mồi ngon , nhan vien nhanh nhẹn nhiet tinh , sẽ comeback",15,2,2,2,0
5 sao,"quán đồ ăn ngon, rẻ, không gian thoáng mát",9,2,0,2,2
5 sao,lẩu ngon . lẩu cả nhà mình ăn ai cũng khen hết. mỗi cái nhậu có 1 nhà vệ sinh đợi hơi lâu. còn lại 10 điểm,28,2,0,1,0
5 sao,"đồ ăn ngon, rẻ.",4,2,0,0,2
5 sao,"nhân viên vui vẻ , đồ ăn ngon giá hợp lý",11,2,2,0,2
5 sao,quán đồ ăn ngon,4,2,0,0,0
5 sao,quá tuyệt vời không còn gì để chê,8,0,0,0,0
5 sao,"món ăn rất hợp khẩu vị, lên món nhanh , không đợi chờ lâu.",14,2,2,0,0
5 sao,quán này mở nhạc cuốn lắm. ai mà thất tình dô đây nhậu là khỏi dìa,16,0,0,2,0
5 sao,"món ăn ngon, nhân viên bếp đẹp trai vui vẻ lần sau sẽ quay lại",15,2,2,0,0
5 sao,"ngon bổ rẻ nhân viên nhiệt tình, không gian thoáng mát chill",12,2,2,2,2
5 sao,đồ ăn ngon nhân viên nhiệt tình dễ thương,9,2,2,0,0
1 sao,"quán nhan viên tệ , không gian tệ",8,0,1,1,0
5 sao,hôm mình ghé trời mưa.ăn đồ nướng nhé nhạc cảm giác hơi phê luôn đây nói chung ngon,18,2,0,0,0
5 sao,giá bình dân.quán không gian thoáng mát.nhất định sẽ quay lại,12,0,0,2,2
5 sao,lẩu gà ngon có ưu đãi nhiều buổi trưa mọi người trãi nghiệm nhé,14,2,0,0,0
5 sao,"không gian thoáng mát, đồ ăn ngon , phục vụ tốt",11,2,2,2,0
5 sao,"quán ăn ngon, trang trí sang trọng, bắt mắt anngoncungsu",10,2,0,2,0
5 sao,bạn thành phục vụ khá dể thương lần sao sẽ đến,11,0,2,0,0
5 sao,quán rất đẹp mọi người nên ghé đến 1 lần,9,0,0,2,0
5 sao,lẩu riêu cua bắp bò bao ngon ăn nhiều lần rồi vẫn muốn ăn tiếp,16,2,0,0,0
5 sao,"phục vụ tốt , đồ ăn ngon",7,2,2,0,0
5 sao,khỏi phải chê nhé rất nhiều món ngon,9,2,0,0,0
5 sao,lẩu gà ổn thông gian ổn phục vụ rất là ổn luôn ae. ơi.,14,2,2,3,0
5 sao,"tôi đi ăn rồi vừa rẻ vừa hợp túi tiền cho các bạn đi đông nhé ,",17,0,0,0,2
5 sao,bạn thành phục vụ dễ thương 10đ không có nhưng,10,0,2,0,0
5 sao,đồ ăn ngon phục vụ tận tình,7,2,2,0,0
5 sao,quán phục vụ nhiệt tình lịch sự chu đáo,9,0,2,0,0
5 sao,"đồ ăn ngon , phụ vụ tốt",7,2,2,0,0
1 sao,"phục vụ quá tệ, lóng nga lóng ngóng",8,0,1,0,0
1 sao,món ăn có lông,4,1,0,0,0
5 sao,tuyệt đúng vị mình thích mấy. lẩu gà vị đậm đà,11,2,0,0,0
1 sao,lên món quá lâu,4,0,1,0,0
5 sao,quán ngon .phục vụ dễ thương,6,2,2,0,0
5 sao,đồ ăn ngon nhức nách,5,2,0,0,0
5 sao,hơi ồn tí nhưng mà tổng thể ổn,8,0,0,1,0
5 sao,đồ ăn phục vụ ổn,5,3,3,0,0
5 sao,10đ không có nhưng,4,0,0,0,0
5 sao,quán 10đ không có nhưng,5,0,0,0,0
5 sao,bạn thành dễ huông,4,0,2,0,0
5 sao,nhân viên ngồi xa quá kêu mệt,6,0,1,0,0
5 sao,10 không có nhưng,4,0,0,0,0
5 sao,ngon,1,2,0,0,0
1 sao,tệ,1,0,0,0,0
5 sao,"đồ ăn không có gì đặc biệt hay ngon cả, nhưng không khí thì tuyệt vời; không khí là tất cả anh chàng hát karaoke hát rất hay;",28,1,0,2,0
5 sao,"tôi rất khuyên bạn nên đến nhà hàng này. đồ ăn ngon và phục vụ tuyệt vời. nó hơi xa một chút, nhưng nếu bạn là người thái và muốn thử, tôi thực sự khuyên bạn nên đến. bạn sẽ hiểu người việt nam dễ mến đến mức nào.",49,2,2,0,0
4 sao,quá nhiều,2,0,0,0,0
5 sao,"món ăn rất ngon, chắc chắn tôi sẽ quay lại.",10,2,0,0,0
5 sao,"bò né đầy đặn, thịt mềm, trứng béo, ăn kèm bánh mì rất hợp. món lên nhanh, hương vị đậm đà, giá hợp lý. điểm cộng dễ thương là quán có tặng bao lì xì dịp tết",38,2,2,0,2
5 sao,ei thấy mấy chỗ 3 ngon ăn nào cũng y chang nào nên riết cũng không biết đánh giá viết com sao cho nó kiểu bật lên được. thí dụ mốt mà chỗ này có gì biển động thì cập nhật chứ hiện tại là ổn ngon é,51,2,0,0,0
2 sao,"bánh mì đặc ruột, sốt bò ít quá, thịt bò cũng tạm được, pate không bùi lắm, xúc xích loại rẻ tiền được cắt ra chứ không được hẳn trọn 1 cây, gọi combo được tặng 1 ly cocapepsi cũng tạm, bánh mì gọi thêm 5 vndổ. nói chung là đồ ăn chán, không muốn quay lại.",56,1,0,0,0
2 sao,bò sốt thì nhạt không nó một miếng nước sốt bò gì để chấm bánh mì luôn bò khét. cục patê để miếng hình vuông lạnh tanh ăn vào tanh thật luôn. thêm nữa 2 miếng súc xích và chả gì đó không nóng được luôn không có món gì hòa quyện với món gì mình đi 2 người gọi 2 né 3 . lần đầu ăn thất vọng luôn.,70,1,0,0,0
1 sao,"đồ ăn thì em thấy khá ổn nhưng vấn đề nằm ở chỗ mấy bạn nhân viên rất là thái độ , các bạn nữ ở đó dễ thương lắm mà mấy bn nam trả hiểu sao thái độ khủng khiếp luôn á , đưa món ra cho mình mà như kiểu dằn mặt v á , đập một cái đùng xuống rồi cái thái độ ở mặt rất là khó chịu , lần đầu tiền mình đến ủng hộ quán dù đồ ăn có ngon mà nhân viên thái độ như v thì mình trả muốn đến lần 2",100,2,1,0,0
2 sao,"quán giá cả cũng phải chăng đó. 2 người gọi combo nướng 299 vnd sốt phô mai trứng muối, thêm 1 ly nước ngọt. tổng 318 vnd món ăn cũng ổn nhưng vệ sinh không tốt. mới bỏ thịt lên chảo nướng thì 2-3 con gián con nó chui ra từ bếp gas mini. dù cố đuổi đi nhưng tụi nó cứ chui ra vô chạy khắp cả bàn! không nhịn nổi mình gọi nhân viên ra và thay cái bếp gas mới thì mới ăn yên ổn nổi. hic không thấy thì không sao, nhưng thấy thì cũng cố mà ăn thôi. tại vì ở nhà sạch sẽ v cũng không thoát khỏi gián huống hồ gì đây quán nấu mỡ bắn tùm lum ra bếp gas z khó tránh khỏi. nên mình cũng không bắt đền gì quán cả hy vọng quán cải thiện vệ sinh, món ăn dầu mỡ khách thấy như vậy sẽ chạy dài không quay lại nữa đâu. nhân viên cũng nhanh nhẹn. vào bàn phải gọi nhân viên order món nhé. chứ ngồi chờ là ngồi cả nửa tiếng nhân viên vẫn chưa biết ra đưa menu đâu. xưa đi ăn đây vài lần, nay quay lại trải nghiệm không tốt nên chắc sau không quay lại nữa",214,2,3,1,2
1 sao,"khuyến cáo là tệ lắm mọi người ơi! 1- mình vô hơi trễ, nên lịch sự hỏi: em ơi mình mấy giờ đóng cửa, giờ còn phục vụ không em? em ấy trả lời: vô hỏi thu ngân á chị nhân viên mà không biếy mấy giờ đóng cửa? 2- mình gọi 1 phần né3 49 vnd. có dặn là làm chín kỹ trứng thịt giùm vì mình không ăn đồ tái đồ sống được. nhưng khi bưng ra, trứng vẫn còn sệt, bò vẫn rỉ máu. phần né khô rang không có sốt, pate không ngon. 3- rau có kiến hôi, một số bị úng cuống do cắt sẵn để lâu. 4- khăn ướt 2 vnd. không có khăn giấy. 5- nước ngọt nó lạt nhách. 6- bàn còn mỡ, không được sạch sẽ, sàn dơ. 7- bưng khay gang ra, các bạn chỉ để mé bàn, để cho khách tự kéo thức ăn vô trước mặt. quán thì lớn, nhiều chi nhánh mà chất tượng tệ. nhân viên chậm chạp, không niềm nở. đi qua đi lại cứ lạch bạch như vịt mắc mưa. giờ ăn xong được 1 tiếng bụng bắt đầu đau rồi.",195,1,1,1,0
4 sao,"quán ăn khá ngon và không gian rộng rãi, nằm ngay ngã 3 nên có khá nhiều chỗ để xe. đồ ăn thì ổn và giá rẻ. tuy nhiên do tính chất bò né nên sàn hơi dơ và dầu mỡ",41,2,0,2,2
5 sao,"quán bò thơm ngon, tuy nhiên món giá 25 vnd so sánh với 75 vnd không khác nhau nhiều về số lượng và chất lượng, nên kinh nghiệm thường chọn món 25 vnd-45 vnd",30,2,0,0,3
5 sao,"quán ăn khá ngon và giá cả ổn áp ạ, mọi người nên thử",14,2,0,0,2
1 sao,không muốn tiếp khách thì nói chứ nhân viên phục vụ mang món ra mà quăng xuống bàn cái rầm như dằn mặt vậy,25,0,1,0,0
1 sao,"quá mặn, không có sốt chấm còn bị khét nữa. với giá 42 vnd thì thất vọng còn không đủ nhét kẻ răng",23,1,0,0,1
5 sao,nhân viên phục vụ nhiệt tình dethg lắm luôn đồ ăn 10 đ. tôi ăn lúc 18h ngày 512 nhen,20,2,2,0,0
1 sao,"mình đi và có gọi hàu né phô mai với một cái lẩu tomyum nhỏ, hàu né phô mai thì ổn nhưng mà lúc bưng cái lẩu ra mình thấy nghi nghi, vừa sôi lên là bọt nổi lên xong nước lẩu nhớt nhớt sệt sệt như súp cua và không có vị gì khác ngoài vị chua, và sau đó về mình đã bị đau bụng khuyên mọi người có ăn thì không nên ăn lẩu tomyum nhé, mình đi ăn hôm nay lúc 5h ngày 167",87,1,0,0,0
1 sao,"đi lần nào cũng không có ớt , pate thì lạnh tanh, trứng với bò thì sống",18,1,0,0,0
1 sao,đồ ăn mắc và dở vợ chồng mình order 1 phần bò nướng tảng nhưng chỉ có 4 miếng bò. giá 260 vnd. phục vụ cũng tệ. mọi người nên cân nhắc. mình có trải nghiệm không mấy vui vẻ khi thưởng thức đồ ăn ở đây,46,1,1,0,1
1 sao,"chưa bao giờ ăn quán nào có phục vụ kì như vậy. mình ăn ở quán vào tối ngày 28đem nước lẩu ra đến khi sôi vẫn chưa đem topping và chén đũa ra, mình nhắc mới đem ra. ăn lẩu chua cay xin thêm nước lẩu lại đổ nước lẩu tomyum vào. ăn còn dư thịt bò nhiều, nói nhân viên gói lại cho mình đem về, bill ra lúc 21h20 mà đến 21h40 vẫn chưa thấy mang ra, vào nhắc đợi thêm tầm 5p thì nhân viên đem ra hộp thịt và bịch nước lẩu cho mình. mang về nhà mới biết bịch nước lẩu đó là nước lẩu cũ mà mình ăn lúc nãy. tức ngủ không được luôn. không bao giờ quay.",127,0,1,0,0
2 sao,"thức ăn tạm cho là ổn về mặt hình thức nhưng cả mình và bạn ăn cùng sáng ra bị đau bụng, mình đã phải đi ngoài 4 lần nên không rõ nguồn gốc thực phẩm có đáng tin không. đánh giá cao phần phục vụ từ khâu giữ xe đến các bạn phục vụ. không gian nhỏ, bàn nhiều dầu mỡ, sàn không sạch sẽ, do tính chất món ăn nhiều dầy mỡ, các bạn nên lau bàn lại với dung dịch tẩy dành cho thực phẩm và lau lại sàn khi vắng khách. rất tiếc trải nghiệm không tốt ở lần đầu tiên nên mình không có ý định ăn lần",114,3,2,1,0
1 sao,"lẩu dở tệ . lần đầu ăn gọi lẩu tứ xuyên đem ra tôm dum , vị nhạt và chua không có gì đặc biệt . nhân viên lơ cả khách gọi không nghe !",35,1,1,0,0
5 sao,đồ ăn hợp khẩu vị của mình sẽ quay lại cho lần sau,13,2,0,0,0
5 sao,đồ ăn hợp vị mình đi 3 người ăn no căng bụng,12,2,0,0,0
1 sao,"kêu ra order món nhưng nhân viên lại không ra, trong khi thấy bạn nhân viên đó giỡn với bàn ăn bên cạnh. bó tay thật. mình đứng dậy đi về luôn. tạm biệt và không hẹn gặp lại",37,0,1,0,0
5 sao,nhân viên dễ thương. bánh mì là bánh mì bơ. thực đơn ổn,13,2,2,0,0
4 sao,"món ăn ngon, quán rộng rãi, thoáng mát.",8,2,0,2,0
5 sao,"đồ ăn ngon tốt , giá cả vừa túi tiền cho học sinh sinh viên , ai chưa ăn lên ẳn thử 1 lần",24,2,0,0,2
1 sao,"nhân viên không chú ý khách hàng lo giỡn khách hàng kêu tính tiền không nghe, còn lúc order đồ ăn em đã dặn 2 lần món em không bỏ pate nhưng vẫn cho pate vào ạ, mong nhân viên bên mình chú ý hơn.",45,0,1,0,0
5 sao,món ăn ngon!chất lượng!giá ổn áp!phục vụ nhanh!combo bò hàu ăn 3 người mà nó quên đường về,18,2,2,0,2
5 sao,"rau tươi , món ăn ngon, nhân viên vui vẻ nhiệt tình",12,2,2,0,0
1 sao,"cực kỳ tệ. đợi tầm 30 phút, chưa có món lên, bàn bên cạnh, tới sau lại được lên món trước. nhân viên chậm chạp trong khi quán không quá đông. khách dời đi vì phải đợi lâu, nhân viên cũng chỉ đứng nhìn. thua. không bao giờ quay lại.",50,0,1,0,0
1 sao,"nhân viên thiếu chuyên nghiệp quán có đội ngũ nhân viên cực kì thiếu chuyên nghiệp, không những một mà đến 3 lần. - lần 1: gọi 2 phần né 2 mà chỉ đem lên 1 phần nhân viên oder nghe không rõ, có thể bỏ qua - lần 2: sau khi mình nhắc, đã có bạn lên xác nhận lại gọi 2 phần né 2, bạn nhân viên đã xác nhận, và một lúc lâu sau vẫn không thấy phần né 2 thứ 2 đâu bếp và order không có giao tiếp với nhau - lần 3: đến lúc thanh toán, dù không có phần né 2 thứ 2, các bạn vẫn tính vào hoá đơn, sau khi mình nói không có phần đó trên bàn thì mấy bạn nhân viên tỏ thái độ liền, không có lấy một lời xin lỗi cả về việc lên món thiếu cũng như tính hoá đơn sai. nhân viên thạo việc người ta nhìn mâm dĩa trên bàn cũng đủ biết khách ăn món gì món gì rồi. nói chung là quá thất vọng, trừ âm điểm và không ghé lại lần",193,0,1,0,0
4 sao,"một phần khá nhiều, ăn tạm, giá rẻ, bình dân phù hợp sinh viên, quán bé nhưng hơi nóng, có tặng kem tráng miệng. thực đơn đa dạng",27,3,0,1,2
5 sao,"đồ ăn ngon, hợp khẩu vị, phục vụ nhiệt tình, đồ ra khá nhanh, nên thử nhé",17,2,2,0,0
5 sao,"quán ăn ngon , phù hợp , giá cả phù hợp chất lượng đáng để trải nghiệm",17,2,0,0,2
5 sao,"không gian thoáng, đồ ăn ổn.",6,3,0,2,0
1 sao,"thái độ nhân viên không nhiệt tình, dịch vụ không chuyên nghiệp, nhân viên ngó lơ không phản hồi lại khách hàng cụ thể là bạn nam đeo kính ạ!. rất rất không hài lòng và thất vọng.",38,0,1,0,0
1 sao,"rất bực nhé, 10h hơn mình có ghé quán trong khi quán vẫn còn bàn đang ăn chứ không phải không có người ăn mà mình vô. các bạn nhân viên có thể nói thẳng hoặc khéo là quán hiện sắp đóng để mình đi quán khác, đằng này vô quán nhân viên liếc liếc tỏ vẻ khó chịu ngồi ăn nhân viên dọn bàn rầm rầm đuổi khách à. ngay từ đầu có thể không nhận khách chứ đừng kiểu khách ăn mà dọn bàn vậy rất mất lịch sự. làm ăn mất cả ngon, bực thiệt sự.",99,0,1,0,0
1 sao,"quán này mình thấy nhiều cmt nói về nhân viên nhưng nhân viên ở đây vẫn cứ trơ trơ ra như vậy, vào quán ăn nhân viên không take care ngồi nhìn mà cái mặt y như cái mền xong nhân viên nhiều lúc còn lườm liếc mình nữa, cứ giữ cái thái độ đó thì quán dẹp tiệm sớm đi",62,0,1,0,0
1 sao,"quán ăn rất tệ. bàn ghế tại quán quá dơ, toàn dầu mở ngồi vào rất bẩn. nhân viên quán không nhiệt tình, không niềm nở, chỉ biết đứng nhìn, cười cợt rất khó chịu. quán đông nhân viên nhưng mà phục vụ rất kém. thấy quán có nhiều chi nhánh nên vào xem nhưng mà chất lượng quá tệ, sẽ không ghé lại lần",68,0,1,1,0
1 sao,mấy món khác mình sao không biết nhưng bò né đĩa salad trộn có con ruồi chết muốn lên men bonus thêm kiến. nhân viên gọi mấy lần không care trong khi khách xung quanh cũng v,37,1,1,0,0
1 sao,"đồ ăn bình thường chỗ khác ăn cùng giá mà ngon hơn nữa. phục vụ chậm, khách vắng mà vô không ai quan tâm luôn.",25,3,1,0,0
