rating,text,word_count,food,service,place,cost
1 sao,"hôm trước mình và bạn mình có đi ăn thử xem do đi ngang thấy vài lần, nhìn cũng khá đông. vào quán tầm giờ trưa. quán thì đông kịt mà chỗ thì ít, may mình vừa vào có nhóm vừa đi thế là nvien bảo mình vào đấy ngồi luôn. mình có hỏi thử không có chỗ trên tầng ạ do trưa nóng mà thấy ghi có điều hoà thì nvien bảo chưa mở. đồ ăn mình thấy không có gì đặc biệt, ăn cũng bthg, khẩu phần ăn cũng ít mà đắt thì thôi nhé luôn, đi 2 người ăn tận 100 mấy hơn. đem đồ ăn ra thì tô mình thấy có sợi tóc ngắn ngắn nữa. cam đoan không phải tóc mình rơi vào do tóc mình dài với dày sợi hơn. đã thế lúc mình xin nvien cho mình chén đựng nc chấm thì bạn nhăn mặt rõ luôn, không biết là do đông quá hay sao mà nhăn mặt là thấy mất hẳn thiện cảm. mình cũng dễ tính nên định thông cảm cho quán rồi. thế nào mà mình và bạn mình ăn xong, 2 đứa về cũng không hề ăn gì thêm mà bạn mình thì bị trúng thực, tiêu chảy rồi sốt cả chiều đến tối. thôi sau không quay lại nhé.",221,1,1,1,1
4 sao,"mình hay ăn chè đối diện thấy quán mới mở nên ghé thử. mặt bằng cũng rộng rãi, thoáng mát, quán khá bận rộn, nhân viên toàn mấy e sinh viên trẻ trung. mình ăn 2 hủ tíu pi thái, 1 tô lớn nước đục và 1 tô vừa nước trong, cảm nhận như ăn hủ tíu nam vang kèm nước phở bò thêm vị hơi chua cay của lẩu thái. phần ăn cũng không nhiều, chủ yếu thịt heo cắt sợi ăn mềm, thịt bò được 2 miếng chúc éc, ai ăn khoẻ thì đói nhé. quán có trà đá free tự phục vụ, nhưng ly dùng chung. thỉnh thoảng đổi vị ăn cũng ổn, nhưng đánh giá khách quan thì hơi mắc so với phần ăn.",128,3,0,2,1
5 sao,"quán này gần nhà mình nè, đồ ăn ngon lắm nhé, nước cũng ngon mà chuẩn vị thái nữa, không gian mát mẻ sạch sẽ. nói chung các bạn nên thử ghé moitj lần",34,2,0,2,0
5 sao,đã ăn nhiều lần ở đây vì đồ ăn ngon hợp khẩu vị. không gian quán khá thoáng. nhân viên phục vụ tận tình. quán 10đ không nhưng,28,2,2,2,0
5 sao,"hủ tiếu ngon, vị đậm đà, xí quách giống bên thái nhé, trà sữa cũng ngon nữa có 1 điểm trừ xí xi là không gian hơi bé và hơn nóng thoi còn lại 10 điểm không có nhưng.",40,2,0,1,0
2 sao,"ngon và nhân viên phục vụ rất chuyên nghiệp, ghé ăn lại rất nhiều lần. quán đổi menu rồi , vị dở hơn không quay lại 1942024",28,1,2,0,0
5 sao,"hủ tiếu ngon, đậm vị. mình thích nhất là món trứng sốt me, trứng lòng đào vừa phải beo béo kết hợp sốt me chua mừi đỉm luôn không gian quán mát mẻ, nhạc hay. thức ăn ra nhanh và các bạn nhân viên cũng rất nhiệt lình luôn ạ.",51,2,2,2,0
5 sao,"đồ ăn ngon, nhân viên phục vụ nhiệt tình lắm mọi người oi",12,2,2,0,0
5 sao,"quán nhỏ nhưng chất lượng tuyệt vời, đồ ăn ở đây làm ngon vừa miệng, không giang sạch sẽ, nhân viên nhiệt tình",23,2,2,2,0
4 sao,"đi ngang thấy quán màu vàng nổi bần bật ở ngã 4 nguyễn thái sơn - phan văn trị. để bảng giá 35 vnd để hút khách nhưng chỉ có tô hủ tiếu heo có giá đó thôi nhé quý vị vào đây thì mình hay ăn hủ tiếu tomyum và pi thai. tomyum không chua nhưng có dầu ớt ăn không cẩn thận bị sặc lúc nào không hay pi thai thì nước dùng thanh hơn. điểm cộng là lát thịt dày cui và cho nhiều, sợi hủ tiếu dai ngon. gia vị để bàn gồm sa tế, prik nám sôm cay nhé với sốt suki chấm thịt. tại quán có quầy trà đá tự phục vụ, khăn ướt để sẵn trên bàn có tính phí. tốc độ ra món không lâu lắm. 1 khẩu phần ăn sẽ hơi ít đối với những ai ăn mạnh nên giá cả nhìn chung hơi đắt xí. lúc tính tiền thì phải đến quầy thu ngân để thanh toán.",168,2,3,0,1
5 sao,"quán hơi nóng, thức ăn nấu chắc đậm vị thái, cá nhân mình thấy phù hợp ai yêu món thái, sạch sẽ lên món nhanh",25,2,2,1,0
3 sao,quán ăn rất ngon và mình đã đi ăn lại rất nhiều nhưng tối hôm nay 210 mình đi ăn lại và thái độ của một bạn nhân viên nam có vẻ không được thân thiện khi mình và bạn mình đến cụ thể lúc đó trời mưa và tụi mình sợ ướt không gian bên trong quán nên ra ngoài ngồi nhưng không biết vì lí do gì thái độ phục vụ bạn nhân viên nam đó không được tốt như các lần trước đến ăn. mình mong quán có biện pháp khắc phục cũng như đừng làm ảnh hưởng đến trải nghiệm của mình lẫn các bạn khác sau này dù quán ăn rất là ngon ạ!,119,2,1,0,0
5 sao,"ngon rất ngon, vị vừa miệng, có thể ăn ở đây mỗi ngày, ghiền luôn á",16,2,0,0,0
1 sao,"trước ăn mấy lần còn ngon, qua mới ghé lại ăn như đấm vào mồm, đồ ăn thì ngày càng ít, nước chấm như bị hư, trà đá không có, nước gọi cũng không luôn lần cuối ghé luôn",40,1,0,0,0
4 sao,"hủ tiếu ăn ngon, lên món cũng vừa phải không bị lâu, có đều nếu training nhân viên chuyên nghiệp hơn thì càng tốt, với vị trí quán nằm chỗ mặt tiền dễ tìm, nhiều xe qua lại, có đều nằm ngay con dốc, xe đậu đèn đỏ nhiều xong rồi ga thì mùi khói hơi nồng nặc, ngồi ăn chút hít cũng hơi bị nhiều khói.",67,2,3,1,0
5 sao,"quán nhỏ mà chất lượng làm mình bất ngờ luôn! mình gọi tô hủ tiếu heo nhỏ, ăn vừa miệng mà ngon hết sảy. nước dùng thì khỏi nói, húp một muỗng là ghiền liền. không gian sạch sẽ, nhân viên dễ thương và cực kỳ vui vẻ, làm trải nghiệm càng thêm tuyệt vời, nhất định sẽ giới thiệu bạn bè tới ăn thử",65,2,2,2,0
5 sao,"hủ tiếu ngon, giá cả cũng hợp lý. đã ăn ở đây nhiều lần. mấy bạn nhân viên ở đây rất nhiệt tình tư vấn khách.",26,2,2,0,2
5 sao,"một trải nghiệm tuyệt vời từ món ăn cho đến phục vụ rất xứng đáng để quay lại nhiều lần! mình thật sự rất hài lòng với trải nghiệm tại quán mọi thứ đều vượt mong đợi. từ không gian, món ăn, thái độ nhân viên cho đến cách quản lý vận hành tất cả đều toát lên sự chuyên nghiệp, tử tế và có tâm. món hủ tiếu là điểm sáng của quán: nước dùng đậm đà, vị ngọt thanh tự nhiên, không quá mặn cũng không bị lạt, sợi hủ tiếu mềm dai vừa phải, topping thì đầy đặn và tươi ngon. thịt được cắt vừa miếng, tôm chín tới, không tanh, trứng lòng đào chuẩn vị. đặc biệt, tô hủ tiếu được bếp chuẩn bị rất chỉn chu, sạch sẽ, bắt mắt, vừa nhìn là muốn ăn ngay. mình rất ấn tượng vì nhà bếp mở nên khách dễ dàng thấy đầu bếp thao tác chuyên nghiệp và cực kỳ vệ sinh. mặc dù quán không phục vụ trà đá miễn phí như một số nơi, nhưng thay vào đó lại có trà sữa tráng miệng cực kỳ ngon không chỉ là một món giải khát mà gần như là một phần kết thúc hoàn hảo cho bữa ăn. trà sữa thơm, béo nhẹ, ngọt dịu, uống không bị ngán. đây là một điểm cộng lớn cảm thấy được chiêu đãi chứ không phải thiếu sót gì cả. về nhân viên phục vụ thì phải nói là rất xuất sắc. ai nấy đều nhanh nhẹn, lễ phép, cười tươi, nói chuyện dễ thương, đặc biệt là quan sát cực kỳ tinh tế. mình chưa kịp gọi thêm thì các bạn đã chủ động hỏi, để ý từ việc khách cần gì, còn thiếu gì cho đến việc dọn dẹp bàn ghế, mang món ra nhanh chóng. thái độ phục vụ khiến mình cảm thấy rất được trân trọng và thoải mái không đơn thuần là ăn ngon mà còn là được phục vụ tận tình. điều khiến mình bất ngờ nhất là cách quản lý quán quá chuyên nghiệp. mọi quy trình đều trôi chảy, gọn gàng, nhân viên làm việc nhịp nhàng như một hệ thống được huấn luyện kỹ lưỡng. rõ ràng, người điều hành ở đây có kinh nghiệm và đầu tư nghiêm túc, không chỉ trong món ăn mà cả con người, thái độ và dịch vụ. từ cách nhân viên chào đón, phục vụ, đến cách bếp hoạt động, đồng phục chỉnh tề tất cả đều thể hiện một tập thể được đào tạo bài bản và tử tế.",449,2,2,2,0
5 sao,"đồ ăn ngon, nhân viên nhiệt tình",7,2,2,0,0
5 sao,đồ ăn ngon sạch. chất lượng ổn áp ổn so với gia tiền.,13,2,0,0,2
5 sao,"đồ ăn ngon, mọi ngừoi nên đến thử",8,2,0,0,0
5 sao,"mình ăn hủ tiểu tomyum, vị khá vừa miệng, dễ ăn, không quá cay, trà sữa uống thớm béo, đậm vị. nch là khá ổn trong tầm giá.",28,2,0,0,0
5 sao,"hủ tiếu ở đây ăn ổn, lên món nhanh, vị tomyum giống với mình từng ăn bên thái, nhưng có điều chỉnh lại để phù hợp với người vn.",29,2,0,0,2
5 sao,mình dẫn bạn đi ăn theo mà thấy bạn khen quá tr luôn . recommend mọi người là ăn hủ tiếu tomyum heo đặc biệt nước sữa siêu ngon luôn món ruột của tôi keke,34,3,0,0,0
5 sao,"quán ngon, ăn sạch tô, nhân viên nhiệt tình",9,2,2,0,0
1 sao,quán quá tệ sáng nay ăn gọi món mà quán làm nhầm cho bàn trên bếp không biết ngta đụng đũa hay chưa mà vẫn mang qua cho mình trong khi 2 tô mà 1 tô mình không biết đã đụng muổg ch có hơi trộn đồ ăn và không mang rau cho mình đến khi mình hỏi thì mang cho mình đĩa rau 2ng mà 3 cọng rau nhỏ không biết cho con gì ăn nữa chén chấm thì khách khác vô thì khăn ướt đi kèm với chén chấm nhưng bàn tôi thì không có bảng treo tường thì để thanh toán tại bàn nhưng lúc thanh toán thì bảo ra quầy ăn lần t3 rồi nhưng hôm nay thất vọng tràn trề,125,1,1,0,0
4 sao,"đã từng ăn ở chi nhánh của thương hiệu này nhiều lần rồi. nói chung là ổn áp. đồ ăn khá là ngon, hợp khẩu vị mình. dịch vụ đầy đủ, nhân viên nhanh nhẹn. không gian thoáng đãng. chỉ có 1 điều duy nhất không hài lòng là trứng lòng đào bóc không được, không biết là do nhân viên quên bỏ vào nc lạnh hay do mình đek biết bóc mà bị dính hết vào vỏ.",77,2,2,2,0
5 sao,"hôm nay đi thấy hủ tiếu thái 35 vnd. nghĩ hủ tiếu hải sản ai dè chỉ có heo và bò. ăn cũng được vì thấy không khác hủ tiếu nam vang hay hủ tiếu thịt heo xí quách, đồ ăn khá nhiều, giá cả ổn. không gian nhỏ chỉ 1 dãy ngay chỗ bếp.",54,3,0,3,2
5 sao,"đồ ăn ngon, nhân viên nhiệt tình ạ",8,2,2,0,0
5 sao,"ngon lắm, không gian quán sạch sẽ, thoáng mát. hủ tíu ngon, đậm vị.",14,2,0,2,0
4 sao,"quán ăn tương đối ngon, đi ăn lần đầu cảm giác thấy ổn: 1 - mình đến vào buổi tối giờ cao điểm, quán đông. order tại bàn, tính tiền tại quầy. ưu điểm là phục vụ niềm nở, ra món nhanh. 2 - mình order món hủ tiếu tomyum. nước dùng ngon, thơm, thịt mềm. giá 55 vnd có vẻ hơi cao, nhưng chắc do tiền mặt bằng và nhân viên đông. khẩu phần hơi ít so với giá tiền. 3 - món trà sữa thái xanh khá ngon, kết hợp với ly inox nhỏ bỏ đầy đá mát lạnh thật sự là 1 lựa chọn đáng 20 vnd giữa thời tiết nóng nực của sg. có thể quan sát cách làm hủ tiếu trực tiếp được chuẩn bị trước khi trao tận tay. sẽ quay trở lại thử các món còn lại trên menu. 810 điểm nhé.",147,2,2,0,1
5 sao,nhân viên thân thiệt phục vụ tốt thức ăn ngon vừa miệng trà sữa thái xanh cũng ngon nói chung ổn lắm luôn,23,2,2,0,0
5 sao,"không gian quán thoáng mát, sạch sẽ, đồ ăn ngon, nhân viên nhiệt tình. sẽ quay lại lần sau ạ",20,2,2,2,0
2 sao,"nhân viên chưa tận tâm, mình vào đợi một lúc sau nhân viên mới đến order. nếu so với giá thành những món khác thì quán ở đây khá đắt, mình ăn hủ tíu tomyum, vị không ngon như những quán mình đã từng ăn.",45,1,1,0,1
5 sao,"món ăn đa dạng, ngon và sạch sẽ. nhân viên nhiệt tình. sẽ quay lại trong thời gian sớm nhất!",20,2,2,0,0
5 sao,"món ăn ngon, nhân viên phục vụ nhiệt tình. sẽ quay lại",12,2,2,0,0
5 sao,"món ăn ngon đậm đà chuẩn thái xứng đáng lắm nhé toping nhiều ăn no nê luôn, trà đá thơm.",20,2,0,0,0
1 sao,quá đắt so với chất lượng. 75 vnd chỉ có 3 lát thịt mỏng và nữa trái trứng . ít hơn rất nhiều so với hình quảng cáo.nhân viên thiếu thật thà hơi luơn . chè sầu riêng cảm nhận riêng cua mình là sầu bị chua,47,1,1,0,1
5 sao,"đồ ăn ngon, vừa miệng, sạch sẽ nhân viên nhiệt tình.",11,2,2,0,0
5 sao,đồ ăn rất ngon nhé nên thử,7,2,0,0,0
5 sao,hủ tíu tomyum ngon nhức nách nhé mọi người. lần đầu dùng thử sợ không hợp khẩu vị ai dè hợp nhé. giá cũng hợp lí. recommend nên dùng thử 1 lần,31,2,0,0,2
5 sao,"đã dùng món ăn nhiều lần tại đây, từ món rẻ nhất đến món mắc nhất đều ổn ,đậm vị thái",21,2,0,0,0
2 sao,"mình ăn kuay tiew pi thai, theo cảm nhận cá nhân món ăn bình thường, chất lượng so với giá mình thấy không ổn lắm. nhân viên có 2 việc thấy không ổn nhân viên order món xong thì đi thẳng trong khi mình chưa kịp gọi nước, trong khi cửa hàng không đông. trong lúc dùng món, hai bạn nhân viên trong bếp nhìn mình và bạn chỉ trỏ rồi cười với nhau mình cảm thấy rất khó chịu. mình sẽ không quay lại",88,3,1,0,1
5 sao,"lần đầu ăn kiểu thái thấy hương vị lạ khá cuốn, nước dùng đậm đà thiên về mặn và thơm, lạ miệng. ai muốn đổi vị mới thì nên thử",31,2,0,0,0
5 sao,"hủ tiếu tomyum với hủ tiếu bò ở đây ngon cực,vị chua chua cay cay.phục vụ tận tình vui vẻ.sẽ quay lại nhiều lần",24,2,2,0,0
5 sao,"đồ ăn ngon, nhân viên phục vụ chu đáo",9,2,2,0,0
5 sao,đồ ăn ngon. mặt tiền đường dễ tìm.,8,2,0,0,0
5 sao,"đồ ăn ngon, nvien phục vụ nhiệt tình nhé",10,2,2,0,0
5 sao,"đồ ăn ngon đậm vị nhé cả nhà , giá tăng hơn hồi trc nhưng đồ ăn cũng nhiều hơn .",21,2,0,0,1
1 sao,rất lâu sau lần thất vọng trước thì mình có quay lại để nghĩ rằng mình hiểu lầm nhưng thật ra lại là hiểu đúng. thật sự quá tệ - quán cắt luôn phần trà đá - là đặc trưng riêng của quán. hỏi nước thì nước suối không bán mặc dù có trong menu. chủ quán chắc muốn người ăn mua thêm. ăn một lúc mình có nghe bạn quản lý hỏi bạn nhân viên là bàn số 1 có oder nước không?. sau khi nhận câu trả lời thì thái độ dè bỉu ra mặt. - tiếp tục là câu chuyện của bạn quản lý tròn trĩnh cực tệ. tô mình ăn tomyum rất ít đồ ăn. xin thêm 1 phần giá trụng thì bạn quản lý lấy đem qua bàn khác kèm theo câu nói bàn số 1 có giá trụng rồi. trong khi mình đi 2 người và chỉ được 1 chén giá mặc định. chắc do không oder nước nên bạn giận mình. - sau đó mình có xin thêm 2 lần nữa và được bạn nhân viên nam mặt có mụn sorry bạn nhé thì bạn bỏ qua luôn. đến khi bạn nam khác vào nhắc rồi bạn nam ấy tự làm luôn. do mình mặc đồ bần quá chăng do cảm thấy không được tôn trọng nên mình đã tính tiền và không lấy bill. nên không có ảnh chụp. mình thấy bàn kế bên cũng rất bất ngờ vì đến lúc tính tiền 2 người lại gần 200 vnd cộng luôn cả tiền nước. . chắc quán sắp ăn nên làm ra nũa rồi. tạm biệt và không hẹn gặp lại.,279,1,1,0,1
5 sao,"ăn nhiều lần, đồ ăn ngon, quán sạch sẽ",9,2,0,2,0
5 sao,"ngon nhé, nvien dễ thưng, đồ ăn ngon, giá hợp líi, recommend nên đi nhé mọi ngừi",17,2,2,0,2
1 sao,"đi lại quán phục vụ siêu tệ. dẹp luôn quầy trà đá free thì phải luôn có sẵn nước suối cho khách chứ. hỏi tới là không có, hết hàng. quán hôm đó siêu vắng mà lên món đúng lâu. đem 2 cái tô hủ tiếu mà phải đợi khách nhắc mới mang rổ rau cho người ta. chắc bữa đó xui đi nên gặp phụ vụ tệ. tô hủ tiếu mà cái cục xá xíu nhìn hết muốn ăn. từ đánh giá 5 sao mà t cho 1 sao là biết t thất vọng cỡ nào từ chất lượng đồ ăn tới thái độ phục vụ. lần cuối cùng ăn ở chi nhánh này",117,1,1,0,0
5 sao,"chuỗi quán hủ tiếu thái này giờ có cũng nhiều chi nhánh ở sài gòn với menu đa dang lựa chọn và giá cả ở mức trung bình nếu quá quen với hủ tiếu việt nam lâu lâu đổi vị qua mấy quán hủ tiếu thái cũng khá ổn nước dùng đậm đà khá gần với vị thái truyền thống, món ra cũng nhanh",64,2,2,0,3
3 sao,"nước dùng tạm được, không đậm đà lắm. giá thì cũng không đắt. bọn mình thử tô lớn cũng được không đủ no nói chung là ăn được.",30,3,0,0,3
5 sao,ăn ngon lứm nhé nên ghé ăn thử đi mọi người,11,2,0,0,0
5 sao,"đồ ăn ngon, nhân viên nhiệt tình, chu đáo",9,2,2,0,0
5 sao,"đồ ăn ngon, phục vụ tận tình",7,2,2,0,0
5 sao,đồ ăn ngon phục vụ nhiệt tình dễ thương,9,2,2,0,0
5 sao,"nhân viên dể thương vui vẽ đồ ăn ngon , cả chú bảo vệ cũng dể thương chổ để xe thoải mái , sẽ u gr hộ thường xuyên",29,2,2,2,0
5 sao,"món ăn rất ngon. hương vị đậm đà, trình bày đẹp mắt và nguyên liệu tươi",16,2,0,0,0
1 sao,tối ngày 19102025 có ai ăn về bị mệt trong người không. nghi bị ngộ độc giá sống. ăn 3 người chỉ có 2 người ăn giá sống thì bị. còn người kia không ăn thì không bị.,38,1,0,0,0
5 sao,"đồ ăn ngon, nhân viên phục vụ nhiệt tình, quán thoáng mát và sáng.",14,2,2,2,0
3 sao,"m đã thử quán ở trần quang khải và nguyễn thái sơn. theo khẩu vị của mình thì hủ tiếu ăn ổn chứ không ngon xuất sắc, nước dùng thanh không dầu mỡ, topping ít so với giá. giá khá cao so với khẩu phần 1 suất trà sữa uống kèm đá hơi nhạt. thích kiểu dùng ly nhôm ở quán. quán không gian mở không có điều hoà, bảo vệ ngồi gần đó hút thuốc lá bao nhiêu khói bay hết vào quán cái này làm m thấy không hay lắm.",93,3,0,1,1
5 sao,"quán khá đông nhưng nhân viên vẫn rất nhiệt tình, dạ thưa tươi cười. món ăn khá hợp khẩu vị. ở dưới nhà có thêm máy lạnh nữa tuyệt vời.",29,2,2,2,0
5 sao,"đồ ăn ngon , phục vụ món nhanh quán sạch sẽ",11,2,2,2,0
4 sao,"không gian: không gián hơi chật, khá đông, nhiều bàn dịch vụ: nhân viên phục vụ nhanh chóng. không quá niềm nở nhưng không tệ món ăn: hủ tiếu tomyum: không quá cay, ăn ổn, đậm vị hủ tiếu pi thái: đậm vị trà sữa thái xanh: uống với đá thì nhạt",52,3,3,1,0
5 sao,"hủ tiếu dai, nước lèo thơm, thịt mềm. cuối tuần quán khá đông mà hơi ít nhân viên phục vụ các bạn chạy show nhiệt tình. sẽ ghé lại ăn lần tiếp theo. chú bảo vệ vui vẻ nhiệt tình",40,2,2,0,0
5 sao,"1 tô khá nhiều topping, nước lèo ngon, lạ miệng, không gian quán rộng rãi thoáng. giá cả hợp lý.",20,2,0,2,2
5 sao,ăn ở đây rất nhiều lần hủ tiếu rất ngon và nhân viên phục vụ rất dể thương nhiệt tình,20,2,2,0,0
5 sao,"đồ ăn ngon, chất lượng hợp lí, quán sạch sẽ và nhân viên nhiệt tình",15,2,2,2,0
5 sao,"nhân viên siêu dễ thương, take care tận tình, đồ ăn phong phú đa dạng , ngon mắt xỉu",19,2,2,0,0
5 sao,"quán đồ ăn ngon, nvien dễ thương, dịch vụ tốt ahh",11,2,2,0,0
5 sao,"đồ ăn ngon, vừa miệng, ăn nhiều lần lắm rồi 10 điểm",13,2,0,0,0
5 sao,"hủ tiếu ngon tuyệt luôn, đặc biệt cái nước dùng tomyum í, chua cay ăn bắt miệng cực",18,2,0,0,0
5 sao,"đồ ăn ngon , quán sạch sẽ",7,2,0,2,0
1 sao,lễ 9 đã ăn và trải nghiệm. nhân viên tệ vô cùng làm ảnh hưởng trải nghiệm đồ ăn. nói chung quá tệ. kêu chai nước đợi ăn xong mới mang lên. làm ăn kiểu gì vậy.,37,0,1,0,0
5 sao,"đồ ăn ngon , mình thích ăn vị hủ tiếu với nước chua chua ở đây ăn vừa vị ngon mọi người nên thửu nhé",24,2,0,0,0
5 sao,"đồ ăn ngon, đậm vị, không gian quán sạch sẽ thoáng mát, bạn nhân viên nhiệt tình",17,2,2,2,0
5 sao,"service tốt, món ăn ngon. giá ổn mấy bạn nhân viên dễ thương xỉu",14,2,2,0,2
5 sao,"đã ăn thử lần thứ 2, hủ tiếu rất ngon, nước dùng đậm đà. nên ăn thử nhé mọi người",20,2,0,0,0
5 sao,"đồ ăn rất ngon, nên ghé!",6,2,0,0,0
5 sao,"hủ tiếu siêu ngon. nhân viên nhiệt tình, dễ thương. giá cả phải chăng. một tô ăn là no căng rồi.",21,2,2,0,2
4 sao,quán có không gian bố trí khá lạ. món ăn thì khá ổn. quán có cô bé phục vụ vui vẻ.,21,3,2,2,0
5 sao,"hủ tiếu thái ngon, vừa giá tiền. không gian thoán mát ngay mặt đường nên rất dễ tìm.",18,2,0,2,2
5 sao,đồ ăn ngon. phục vụ nhiệt tình. quán sạch sẽ,10,2,2,2,0
5 sao,"hủ tiếu ngon, hợp khẩu vị. đã dùng ở đây được vài lần. sẽ trở lại đây mỗi khi thèm hủ tiếu thái",23,2,0,0,0
5 sao,"đồ ăn ngon, dịch vụ tốt sẽ ghé đến ăn trong tương lai",13,2,2,0,0
5 sao,"- nhiều món, rẻ nhất là hủ tíu heo 35 vnd - quán khá sạch, bố trí kiểu hàng ghế dài dọc theo bếp như quán nhật - quán có loại nước chấm màu vàng cam khá ngon, vị hơi giống nước chấm ớt đỏ - hủ tíu nước trong vị thanh, hủ tíu trụng vừa tới",56,2,0,2,2
5 sao,"đồ ăn ngon nhé, phục vụ ổn, lần sau tới sg ghé ăn tiếp nè",15,2,2,0,0
5 sao,"quán khá thoáng, mát, đồ ăn thì vị đậm đà nhé ngon nhé mọi người , nên thử nhé",19,2,0,2,0
5 sao,"món ăn ngon bổ rẻ siêu chất lượng, phục vụ tận tình, không gian quán thoáng 5 sao nhé",19,2,2,2,2
5 sao,quán ngon. tô 65 vnd,4,2,0,0,0
5 sao,"mình ăn ở đây vài lần từ khi quán mới khai trương, mình ăn mấy món hủ tiếu thái ở đây vì nước dùng với hương vị rất đậm đà",30,2,0,0,0
5 sao,"hủ tíu ngon, chua chua cay cay, mình ăn không được cay nên quán có hỗ trợ mình giảm được độ cay, ăn rất hợp vị. có cả hủ tíu không cay nước dùng thanh đạm cho người lớn tuổi và em bé nữa. tuyệt vời ạ",47,2,2,0,0
5 sao,"hủ tíu đậm vị nhân viên phục vụ nhanh chóng, lần đầu ăn rất ổn ạ. mọi người nên thử nhé",20,2,2,0,0
5 sao,"đồ ăn ngon, thoáng mát, phục vụ nhiệt tình dễ thương",11,2,2,2,0
5 sao,"đồ ăn ngon, chắc chắn sẽ quay lại",8,2,0,0,0
4 sao,"hủ tíu ăn ngon vừa vị, phục vụ nhiệt tình và trà đó free siêu ngon",16,2,2,0,0
5 sao,"món ăn ngon, nhân viên thân thiện",7,2,2,0,0
5 sao,nhân viên nhiệt tình lẹ làng phục vụ tận tâm vui vẻ rất ổn,14,0,2,0,0
5 sao,"nhân viên phục vụ tốt, món ăn ngon",8,2,2,0,0
5 sao,sáng chủ nhật quán khá đông nhưng các bạn phục vụ rất nhiệt tình.,14,0,2,0,0
5 sao,"hủ tiếu thơm , ngon , giá cả hợp lý. mình sẽ quay lại ủng hộ quán",17,2,0,0,2
5 sao,"đồ ăn ngon, nhân viên thân thiện",7,2,2,0,0
5 sao,quán ăn rất ngon nhé mọi người,7,2,0,0,0
